{
    "$schema": "http://json-schema.org/draft-07/schema#",
    "additionalProperties": false,
    "properties": {
        "$schema": {
            "type": "string"
        },
        "language": {
            "type": "string",
            "enum": [
                "C",
                "C++"
            ]
        },
        "compiler": {
            "type": "string"
        },
        "file_name": {
            "type": "string"
        },
        "include": {
            "type": "object",
            "additionalProperties": false,
            "properties": {
                "C": {
                    "type": "array",
                    "items": {
                        "type": "string"
                    }
                },
                "C++": {
                    "type": "array",
                    "items": {
                        "type": "string"
                    }
                },
                "H": {
                    "type": "array",
                    "items": {
                        "type": "string"
                    }
                },
                "H++": {
                    "type": "array",
                    "items": {
                        "type": "string"
                    }
                }
            },
            "required": [
                "H"
            ]
        },
        "additional_cpp_options": {
            "type": "object",
            "additionalProperties": false,
            "properties": {
                "extensions": {
                    "type": "object",
                    "additionalProperties": false,
                    "properties": {
                        "code": {
                            "type": "string",
                            "enum": [
                                ".c++",
                                ".cc",
                                ".cp",
                                ".cpp",
                                ".cxx"
                            ]
                        },
                        "header": {
                            "type": "string",
                            "enum": [
                                ".h++",
                                ".hh",
                                ".hp",
                                ".hpp",
                                ".hxx"
                            ]
                        }
                    },
                    "required": [
                        "code",
                        "header"
                    ]
                }
            },
            "required": [
                "extensions"
            ]
        }
    },
    "required": [
        "language",
        "file_name",
        "include"
    ],
    "if": {
        "properties": {
            "language": {
                "const": "C++"
            }
        }
    },
    "then": {
        "required": [
            "additional_cpp_options"
        ]
    },
    "else": {
        "not": {
            "required": [
                "additional_cpp_options"
            ]
        }
    },
    "dependencies": {
        "language": {
            "oneOf": [
                {
                    "properties": {
                        "language": {
                            "const": "C"
                        },
                        "include": {
                            "properties": {
                                "C": {
                                    "type": "array",
                                    "items": {
                                        "type": "string"
                                    }
                                }
                            },
                            "required": [
                                "C"
                            ],
                            "not": {
                                "required": [
                                    "C++"
                                ]
                            }
                        }
                    }
                },
                {
                    "properties": {
                        "language": {
                            "const": "C++"
                        },
                        "include": {
                            "properties": {
                                "C++": {
                                    "type": "array",
                                    "items": {
                                        "type": "string"
                                    }
                                }
                            },
                            "required": [
                                "C++"
                            ],
                            "not": {
                                "required": [
                                    "C"
                                ]
                            }
                        }
                    }
                }
            ]
        }
    }
}